ดีใจด้วยกับคนที่ติดแล้ว รักทุกคนมากๆ พยายามกันมามาก ผ่านอะไรกันมาเข้าใจความรู้สึกทุกคน รู้สึกถึงความเป็นเพื่อนที่ต้อสู้กันมา รอเราหน่อยนะ รอบ4มันจะเป็นของเรา ขอให้ #dek61 ติดคณะที่ชอบ มหาลัยที่หวังไว้นะ #TCASรอบ4 🙏🏻 .เราจะไม่โดนเทรอบ4	pos
ดีใจจมากกก ฮรืออ ได้ใช้แท็กนี้สักที 😭😭😭	pos
ดีใจกับน้องๆทุกคนที่ติดวิศวะ จุฬาฯ ด้วยค่ะ	pos
ดีใจกับคนที่ติดรอบ 3/2ด้วยนะคะ ใครที่รอแอด หรือติดแต่ไม่ถูกใจ อดใจรอกันอีกนิดนะคะ	pos
จากเพจอ.ขลุ่ย ดีใจที่เห็นเพลงนี้ให้กำลังใจคนได้จริงๆ สู้ๆนะน้อง มันอาจจะเหนื่อยจนท้อบ้าง แต่สักวันมันจะเป็นวันของเรา พี่เป็นกำลังใจให้ /กอดๆ	pos
จริงๆนะ คือไม่มีใครเข้าใจ #dek61 เท่าพวกเรากันเองแล้วอะ อยากนัดทุกคนไปยื่นกอดคอร้องไห้55555555 แม่งหนักจริง ว่าจะไม่เครียดแต่แม่งก็อดไม่ได้	neg
จนตอนนี้หนูยังพยายามเข้าเว็บอยู่ ล่มเก่งอีดอก	neg
คือแบบความรู้สึกแม่งโครตแย่อ่า ต้องคอยตอบคำถามคนนั้นคนนี้โน่นนั่นนี่ โอ้ยยยยยย ละที่สำคัญละ เครียดจนประสาทจะแดกกกกไมเกรน!!! คือหมดตังเยอะมากอ่ากับคำว่าสมัครนั่นนี่ บางที่นะแม่งบอกรอบพอตๆไม่ดูพอตดูเกรด!!! เกรดน้อยก้อแพ้ไป คือแบบแย่มากอ่า ห่วยมากเลยยย บางคนก็รอจนรากจะออกก้น คือแบบคิดมากไง กูจะมีที่เรียนป่าววะ กูอยากเรียนอันนี่ชอบอันนี้แต่ไม่ได้หวะ งั้นงี้ สารพัดปัญหา จนตอนนี้กูก็ยังไม่มีที่เรียน ไม่มีโอกาสแก้ตัว พลาดคือพลาด กูยากที่จะอธิบาย #เหนื่อยสัส	neg
คือเมื่อคืนฝันดีมาก ฝันว่าได้ใส่ชุดนิสิต ละมีอวดคนอื่นอ่ะ รู้เลยว่าตอนนี้ตัวเองเครียดและหวังไว้สูงมาก	neg
คือดีใจหนักมาก แบบไม่ติดก็ไม่รู้จะต่อไหนแล้วอะ เครียดกันทั้งบ้าน พอสอบติดเท่านั้นแหล่ะ แฮปปี้ยิ้มแก้มแตกกันทั้งครอบครัวไปเลยจ้า	pos
คะแนนน้อย ไม่ถึงเกณฑ์แต่ก็หน้าด้านยื่นอะเอ้ออ 😂	neg
ความห่วยแตกของระบบในปีนี้ไม่ใช่แค่ระบบรวน เว็บล่ม เด็กกั๊กที่กันเยอะ แต่การที่ระบบห่วยแบบนี้จะส่งผลให้เด็กในปีนี้หลายพันคนยอมจะทิ้งความฝันตัวเองเพื่อแลกกับความสบายใจว่ามีที่เรียน และมันจะส่งผลเป็นโดมิโน่ไปถึงรุ่นต่อๆไปอีก พิจารณาตัวเองได้แล้วนะทปอ. 	neg
คนที่ได้เรียนคณะที่สมหวังแล้ว พ่อแม่เห็นด้วย พ่อแม่สนับสนุน ดีใจด้วยนะ ตั้งใจเรียนนะ คุณโชคดีมากแล้วที่พ่อแม่เค้าเข้าใจคุณ ที่พ่อแม่สนับสนุนคุณ มันดีที่สุดแล้วล่ะ	pos
ขำไม่ออกแต่อยากขำและนอนน้ำตาร่วงอยู่	neg
ขอให้ติด เภสัช มข สาธุ~🙏🙏🙏 ดังนั้นควรอ่านหนังสือได้แล้วนะ~ เหลือเวลาไม่นานแล้วนะ สู้ๆ!!	pos
ขอบคุณมข.ที่ไม่เทเรา มีที่เรียนแล้วโว้ยยยยยยย	pos
ขอบคุณทุกฝ่ายจริงๆทั้งทปอ. ทั้งเด็ก61ผู้ปกครองเด็กทุกฝ่ายที่ยื่นเรื่องให้มีรอบ3.2 ถ้าไม่มีรอบนี้เราคงไม่ติดแง้ ดีใจมาก ❤️	pos
ขอบคุณ มข มากๆนะคะ ที่รักเรา❤❤❤มันเกินความคาดหมายมากๆ เราติด 4 อันที่ยื่นไปหมดเลย	pos
ขอบคุณ #TCAS61 ที่ทำให้คนๆนึงที่ไม่เคยรออะไรได้นานได้รู้ว่าการรอคอยที่แสนยาวนานมันทรมานมากขนาดไหน ขอบคุณจริงๆ😻🙏🙏 	pos
การเลือกมหาวิทยาลัยว่ายากแล้ว คณะที่จะเลือกให้มันพอดีกับคะแนนเรานั้นยากยิ่งกว่า 😭😂 	neg
กรี้ด ดีใจโว้ยยยย 	pos
dek61 ที่ต้องสัมภาษณ์ในวันพรุ่งนี้และมะรืนนี้ สิ่งที่อยากจะฝากคือพยายามตัดความกังวล ตัดความคิดว่าเราจะไม่ติด เตรียมตัวให้พร้อม เอกสารให้ครบ ยิ้มเข้าไว้ มือไม้อย่าแข็ง ห้ามเหวี่ยงใส่อาจารย์ สบตาตอบด้วยความจริงใจ โอกาสอยู่ในมือน้องๆแล้ว ทำให้ดีที่สุดครับ พี่เป็นกำลังใจให้ 💪🏼	pos
Dek61รุ่นนี้เสียเปรียบเห็นๆอ่ะ กว่าจะติดก็ครึ่งค่อนปี จะซิ่วก็ไม่ได้อีก เพราะ เตรียมตัวไม่ทัน มีใครใหัมากกว่านี้อีกมั้ยคะ	neg
"แค่คณะนี้เอง" ทำไมล่ะ ทำไม แค่นี้ของคุณ มันแม่งเป็นสุดยอดของเราเว้ย อย่ามาดูถูกความชอบของคนอื่นสิ ชอบยุ่งจัง พวกไม่ได้ช่วยจ่ายค่าเทอมสักบาทเนี่ย	neg
